sentence,principle,oEffect,oReact,oWant,xAttr,xEffect,xIntent,xNeed,xReact,xWant
there is a boy and a girl.,patience,none,none,none,young,none,none,none,happy,to have a baby
the girl has a jump rope in her hand and is looking down frowning.,patience,none,none,none,scared,gets sweaty,none,none,happy,to jump
the boy also has a jump rope in his hand.,patience,none,none,none,athletic,gets exercise,to be active,to have a rope,happy,to jump
he is frowning and looking at the girl.,patience,none,none,none,curious,none,none,none,happy,to ask her out
they are in gym class.,patience,none,none,none,athletic,gets sweaty,to be healthy,to go to the gym,tired,to get better
they have the rope behind their legs.,patience,none,none,none,prepared,none,to be prepared,none,prepared,to use the rope
