sentence,principle,oEffect,oReact,oWant,xAttr,xEffect,xIntent,xNeed,xReact,xWant
there are two boys and one girl.,humility,none,none,none,young,none,none,none,happy,to have a baby
the first boy is standing in front while the other two stand on either side of him.,humility,none,none,none,brave,none,to be in front,none,happy,to get a better view
the first boy is smiling and has his arms crossed.,humility,none,none,none,playful,none,to be mean,none,happy,to be a good boy
the boy and girl are frowning at him.,humility,none,none,none,mean,none,none,none,annoyed,to tell them something
the girl has her hand on her hips.,humility,none,none,to dance,sexy,gets slapped,to dance,none,happy,to dance
the boy is shaking his head.,humility,none,none,none,scared,gets scolded,none,none,scared,to get away
the girl is looking at the boy.,humility,none,none,to smile,curious,gets a kiss,to be noticed,none,happy,to flirt
the boy is looking at the other boy.,humility,none,none,to talk to personx,curious,none,to be noticed,none,curious,to talk to the boy
