sentence,principle,oEffect,oReact,oWant,xAttr,xEffect,xIntent,xNeed,xReact,xWant
there are two boys sitting at a table.,friendliness,none,none,none,young,none,none,none,happy,to eat
there is a silver platter with two slices of pizza on it.,friendliness,none,none,none,hungry,gets a slice,none,to order the pizza,full,to eat
"in front of the two boys are red plates , cans of soda and napkins.",friendliness,none,none,none,careless,none,none,to be hungry,embarrassed,to clean up
the two boys are looking at each other and smiling.,friendliness,none,none,to smile,friendly,none,none,none,happy,to smile
the first boy is holding up his hand.,friendliness,none,none,none,curious,gets yelled at,to be a good boy,none,happy,to get a kiss
the boy is pointing at the slice of pizza.,friendliness,none,none,none,hungry,gets yelled at,to eat,to be hungry,hungry,to eat
they are other people sitting at the table.,friendliness,none,none,none,social,none,none,none,happy,to eat
they are at a party.,friendliness,none,none,none,social,gets drunk,to have fun,to get dressed,happy,to have fun
they are party decorations in the back.,friendliness,none,none,none,festive,gets tired,to have fun,to buy decorations,happy,to have fun
