sentence,principle,oEffect,oReact,oWant,xAttr,xEffect,xIntent,xNeed,xReact,xWant
there is a boy.,honesty,none,none,none,young,none,none,none,happy,to grow up
in front of the boy is a drawer.,honesty,none,none,none,mean,none,to be a thief,none,sneaky,to get out of the room
the boy has the first drawer open and is pulling out a notebook labeled journal.,honesty,none,none,none,curious,none,to read,to open the drawer,curious,to read the journal
he is looking into the next room where a woman is sitting at a table with a.,honesty,none,none,none,curious,none,to talk to someone,none,curious,to talk to the woman
the boy is grinning.,honesty,none,none,none,happy,none,none,none,happy,to smile
the boy has his hand across his chest.,honesty,none,none,none,mean,gets yelled at,to be mean,none,guilty,to be heard
there are other items in the drawer.,honesty,none,none,none,curious,none,none,none,happy,to keep the items
there is a picture frame on the top of the dresser.,honesty,none,none,none,artistic,none,none,none,happy,to show off their picture
