sentence,principle,oEffect,oReact,oWant,xAttr,xEffect,xIntent,xNeed,xReact,xWant
there is a boy.,friendliness,none,none,none,young,none,none,none,happy,to grow up
he has a phone to his ear and his other hand is leaning against the wall.,friendliness,none,none,none,curious,none,none,none,happy,to talk
"there is a table with the receiver on it , sticky notes , a pen , and.",friendliness,none,none,none,careless,none,none,none,bad,to write
above that is a chalkboard with the word chalkboard written across the top.,friendliness,none,none,none,mean,none,to be a teacher,none,smart,to write a correction
the chalkboard has a smudge of chalk on it.,friendliness,none,none,none,careless,none,none,none,embarrassed,to clean up the mess
the boy is tapping his hand on the wall.,friendliness,none,none,none,curious,gets nervous,to get attention,none,nervous,to get a pencil
