sentence,principle,oEffect,oReact,oWant,xAttr,xEffect,xIntent,xNeed,xReact,xWant
there are two boys they are standing in a dinosaur museum.,law-abiding,none,none,none,curious,none,none,none,happy,to get out of the museum
in front of one of the exhibits are yellow ropes.,law-abiding,none,none,none,curious,none,none,none,happy,to get a better view
the first boy is stepping over the rope.,law-abiding,none,none,none,brave,gets hurt,to be first,to be walking,nervous,to get a better job
he is looking at the second boy and smiling.,law-abiding,none,happy,to smile,interested,none,none,none,happy,to talk to the boy
the second boy is frowning.,law-abiding,none,none,none,annoyed,none,none,none,annoyed,to get away from the boy
the boy has his hand on the pole.,law-abiding,none,none,none,scared,gets hurt,to be helpful,none,happy,to get a ride
the pole is holding the yellow rope together.,law-abiding,none,none,none,helpful,gets tired,to be helpful,to grab the rope,helpful,to get the rope back
