sentence,principle,oEffect,oReact,oWant,xAttr,xEffect,xIntent,xNeed,xReact,xWant
there is a boy standing in a backyard.,friendliness,none,none,none,young,gets dirty,none,none,happy,to play
there is a wooden fence behind him with flowers and shrubs lining the front of it.,friendliness,none,none,none,shady,none,none,none,happy,to keep the fence
a dog is behind him.,friendliness,none,none,none,sneaky,none,none,none,happy,to play with the dog
the boy is smiling and working on something.,friendliness,none,none,none,friendly,none,to be happy,none,happy,to finish the work
the dog is walking.,friendliness,none,none,none,active,gets exercise,to exercise,to get up,happy,to feed the dog
the boy arms up in the air.,friendliness,none,none,none,playful,none,to show off,none,happy,to run
the boy has something in his hand.,friendliness,none,none,none,curious,none,to be helpful,none,happy,to give it to the boy
