sentence,principle,oEffect,oReact,oWant,xAttr,xEffect,xIntent,xNeed,xReact,xWant
there is a boy and his grandfather.,respect,none,none,none,young,none,none,none,happy,to grow up
the boy is looking up at the grandfather and gesturing to a group of photos on top.,respect,none,none,none,curious,none,to be noticed,none,happy,to ask grandfather questions
the boy is saying something to the grandfather.,respect,none,none,to listen to personx,talkative,gets scolded,to communicate,to be a teacher,happy,to get their grandfather 's attention
the grandfather is looking.,respect,none,none,none,curious,none,none,none,happy,to get a drink
down at the boy and is smiling.,respect,none,happy,to smile back,friendly,none,none,none,happy,to say hello
the grandfather is standing next to the boy.,respect,none,happy,to talk to personx,friendly,none,to be near the boy,to walk to the boy,happy,to talk to the boy
the grandfather is holding a cane.,respect,none,none,none,careful,none,to be a cane,to get the cane,happy,to get a drink
the boy is looking at the grandfather.,respect,none,none,to talk to personx,curious,none,to be respectful,none,curious,to talk to the grandfather
