sentence,principle,oEffect,oReact,oWant,xAttr,xEffect,xIntent,xNeed,xReact,xWant
the girl is smiling.,friendliness,none,happy,none,friendly,none,none,none,happy,to kiss her
the boy behind the girl has on glasses.,friendliness,none,none,none,helpful,none,to be able to see,to be in school,happy,to get a new pair
the boy is holding.,friendliness,none,none,none,caring,none,to be helpful,none,happy,to give the boy a treat
water.,friendliness,none,none,none,determined,none,to be a good friend,none,happy,to get a drink
people are riding bikes on the sidewalk.,friendliness,none,none,none,athletic,gets hurt,to have fun,to get on the bike,tired,to get to their destination
the boy holding the bottle of water is looking back at the bikers.,friendliness,none,none,none,curious,none,to be a good listener,none,happy,to get a drink
the girl has her hands in her pockets.,friendliness,none,none,none,sneaky,gets caught,to hide something,none,nervous,to keep them warm
she is smiling.,friendliness,none,none,none,happy,none,none,none,happy,to smile
they are walking down a gravel path.,friendliness,none,none,none,adventurous,gets exercise,to get exercise,to walk down the path,happy,to get to their destination
