sentence,principle,oEffect,oReact,oWant,xAttr,xEffect,xIntent,xNeed,xReact,xWant
the guys are looking at each other.,friendliness,none,none,none,curious,none,to be noticed,none,curious,to talk to them
the boy in the.,friendliness,none,none,none,young,none,none,none,happy,to teach the boy
green shirt is frowning.,friendliness,none,none,none,annoyed,none,none,none,annoyed,to look good
the boy in the purple his an eyebrow up.,friendliness,none,none,none,curious,none,none,none,happy,to get away from the boy
the boy in the purple is gesturing towards something to the side of him.,friendliness,none,none,none,curious,none,to show his interest,none,curious,to get his attention
the boy in the green has his arms crossed.,friendliness,none,none,none,mean,none,to be safe,none,happy,to run away
they are standing in the middle of a path.,friendliness,none,none,none,brave,gets hurt,none,none,nervous,to walk away
two runners are headed straight for them.,friendliness,none,none,none,determined,none,to be in charge,to be in a race,happy,to get to the destination
