sentence,principle,oEffect,oReact,oWant,xAttr,xEffect,xIntent,xNeed,xReact,xWant
the man in the back is waving.,humility,none,none,none,friendly,none,to be friendly,none,happy,to talk to the man
the boy is smiling at the lady.,humility,none,happy,to smile back,friendly,none,none,none,happy,to say hello
there boy has a clipboard.,humility,none,none,none,responsible,none,to be prepared,none,responsible,to do a good job
the man is behind the bushes smiling.,humility,none,none,none,sneaky,none,none,none,happy,to laugh
the boy is holding a book about seeds.,humility,none,none,none,curious,none,to learn,to have a book,interested,to plant seeds
he is handing the book to the lady.,humility,none,grateful,to read,helpful,none,to be helpful,to be a teacher,happy,to give the book back
he is wearing a blue and red shirt that says all star eagle band.,humility,none,none,none,proud,gets complimented,to be a star,to buy a blue shirt,proud,to go to the concert
