sentence,principle,oEffect,oReact,oWant,xAttr,xEffect,xIntent,xNeed,xReact,xWant
the.,respect,none,none,none,determined,none,to be a good friend,none,happy,to get a drink
boy is smacking his knees.,respect,none,none,none,mean,gets slapped,none,none,hurt,to get a drink
there s a small horse by the table.,respect,none,none,none,playful,none,none,none,happy,to feed the horse
there s pizza on the table.,respect,none,none,none,hungry,gets full,to eat,to buy pizza,full,to eat
the man is ordering at the counter.,respect,none,none,none,hungry,gets change,to get something,to go to the counter,hungry,to pay
there is a woman and her daughter sitting at the table.,respect,none,none,none,caring,none,to eat,none,happy,to eat
the daughter is eating her pizza.,respect,none,none,none,hungry,gets full,to eat,to buy the pizza,full,to eat
the woman is looking at the boy.,respect,none,none,to smile,curious,gets a kiss,to be noticed,none,interested,to talk to the boy
the woman s purse is beside her plate.,respect,none,none,none,hungry,none,to eat,to be hungry,happy,to eat
