sentence,principle,oEffect,oReact,oWant,xAttr,xEffect,xIntent,xNeed,xReact,xWant
the children are in a classroom.,respect,none,none,to listen to personx,studious,learns something,to teach children,to be in class,happy,to teach the children
the boy in the green shirt is frowning.,respect,none,none,none,mean,none,none,none,annoyed,to get away from the boy
there is a school news paper on the wall behind the students.,respect,none,none,none,intelligent,none,none,none,interested,to write a caption
the girl is smiling.,respect,none,happy,none,friendly,none,none,none,happy,to kiss her
they are all sitting at desks in a classroom.,respect,none,none,none,studious,gets tired,to learn,none,bored,to learn
the boy in the red shirt is writing something on a piece of paper.,respect,none,none,none,smart,none,to write,to get a piece of paper,smart,to read the paper
he is smiling.,respect,none,none,none,happy,none,none,none,happy,to smile
