sentence,principle,oEffect,oReact,oWant,xAttr,xEffect,xIntent,xNeed,xReact,xWant
the friends are at the park.,caution,none,none,none,social,gets exercise,to have fun,to drive to the park,happy,to have fun
there s lighting in the sky.,caution,none,none,none,curious,none,none,none,happy,to see the stars
the girl is pointing up.,caution,none,none,none,curious,gets yelled at,to be noticed,none,happy,to get a reward
the brown boy and the are frowning.,caution,none,none,none,mean,none,none,none,annoyed,to get away from the situation
the boy with the brown hair is holding a pink frisbee in his hand.,caution,none,none,none,playful,gets hit by the dog,to play with the dog,to be playing with the dog,happy,to play with the dog
he is looking up at the sky and frowning.,caution,none,none,none,pensive,squints,none,none,annoyed,to get a tan
the boy with the green shirt has his hands on his hips and is smiling.,caution,none,none,none,playful,none,to be funny,none,happy,to dance
he is looking at the boy with the brown hair.,caution,none,none,none,curious,gets a haircut,to be noticed,none,happy,to talk to the boy
