sentence,principle,oEffect,oReact,oWant,xAttr,xEffect,xIntent,xNeed,xReact,xWant
the friends are at a hockey game.,self-care,none,happy,to have fun,athletic,gets sweaty,to have fun,to get dressed,happy,to have fun
the purple player is smiling.,self-care,none,none,none,playful,none,none,none,happy,to have fun
the white player is looking at the purple player.,self-care,none,none,none,curious,none,to be entertained,none,happy,to win the game
the friends are frowning.,self-care,none,none,none,annoyed,none,none,none,annoyed,to be left alone
the two friends are sitting behind the glass.,self-care,none,none,none,sneaky,none,to be alone,none,happy,to get up
the player in the purple has his arms up.,self-care,none,none,none,playful,gets hurt,to be a good player,none,happy,to win the game
he is standing behind the hockey net.,self-care,none,none,none,playful,gets exercise,to be in the lead,to be in the game,happy,to win the game
