sentence,principle,oEffect,oReact,oWant,xAttr,xEffect,xIntent,xNeed,xReact,xWant
the friends are in the hall.,friendliness,none,none,to talk,social,none,none,to walk to the hall,happy,to talk
the friends are smiling.,friendliness,none,none,none,friendly,none,none,none,happy,to have a good time
the friends are looking at each other.,friendliness,none,none,none,curious,none,none,none,happy,to talk
the friends have items in there hands.,friendliness,none,none,none,prepared,none,to be prepared,to have a bag,happy,to use what they have
the friend with the blue and green sweater has a dark blue bookbag.,friendliness,none,none,none,outgoing,none,to be fashionable,none,happy,to go to the store
there s a board behind them.,friendliness,none,none,none,sneaky,none,to be sneaky,none,happy,to be in charge
the boy in the red shirt has a yellow book in his hand.,friendliness,none,none,none,curious,none,to read,none,happy,to read the book
