sentence,principle,oEffect,oReact,oWant,xAttr,xEffect,xIntent,xNeed,xReact,xWant
the boys are by the pool.,friendliness,none,none,none,playful,gets exercise,to have fun,to go to the pool,happy,to play
the boys do nt have on shirts.,friendliness,none,none,none,dirty,gets yelled at,none,none,embarrassed,to go to the store
the boy in the green shorts is smiling.,friendliness,none,none,none,friendly,none,none,none,happy,to be a good friend
the boy in the red shorts is frowning.,friendliness,none,none,none,mean,none,none,none,annoyed,to get a tan
the boy in the green shirt is getting into the pool.,friendliness,none,none,none,playful,gets dirty,to have fun,to go to the pool,happy,to swim
the boy in the red shorts is pointing to something.,friendliness,none,none,none,curious,none,to be noticed,none,happy,to tell the boy to stop pointing
