sentence,principle,oEffect,oReact,oWant,xAttr,xEffect,xIntent,xNeed,xReact,xWant
the boys are at a show.,assistiveness,none,none,none,outgoing,gets tired,to be entertained,to buy tickets,happy,to go home
the boy with orange hair has drums.,assistiveness,none,none,none,childish,none,none,none,happy,to play with the drums
the friend is frowning.,assistiveness,none,none,none,annoyed,none,none,none,annoyed,to get away from the friend
the boys are next to each other.,assistiveness,none,none,none,friendly,none,none,none,happy,to be close
the both have on red shirts.,assistiveness,none,none,none,stylish,none,to be fashionable,to buy red shirts,happy,to wear the shirt
the boy that s frowning has a clarinet in his hand.,assistiveness,none,none,none,musical,none,to play a clarinet,to buy a clarinet,happy,to play the clarinet
he has his arms crossed.,assistiveness,none,none,none,defensive,none,to be in control,none,angry,to be in control
