sentence,principle,oEffect,oReact,oWant,xAttr,xEffect,xIntent,xNeed,xReact,xWant
the girl is wearing yellow glasses.,cooperation,none,none,none,blind,gets yelled at,to be able to see,to buy a pair of glasses,happy,to go to the party
the boy is smiling.,cooperation,none,none,none,friendly,none,none,none,happy,to smile
the girl is smiling.,cooperation,none,happy,none,friendly,none,none,none,happy,to kiss her
the boy is holding a card with a star on it.,cooperation,none,none,none,curious,none,none,none,happy,to read the card
the.,cooperation,none,none,none,determined,none,to be a good friend,none,happy,to get a drink
other hand he has a card with a paw on it.,cooperation,none,none,none,curious,none,none,none,happy,to read the card
they are sitting at a table.,cooperation,none,none,none,hungry,gets hungry,to eat,to walk to the table,happy,to eat
on the table green cards are scattered across the table.,cooperation,none,none,none,careless,none,none,none,sad,to win
