sentence,principle,oEffect,oReact,oWant,xAttr,xEffect,xIntent,xNeed,xReact,xWant
there is a boy he has two glasses and he is standing above a cake.,courtesy,none,none,none,young,gets dirty,none,none,happy,to eat the cake
"he is at a party , there is a girl behind him putting the carton of juice.",courtesy,none,none,none,friendly,none,to be a good friend,to be at the party,happy,to drink juice
"a boy and a girl are standing behind a table , there are presents on top of.",courtesy,none,none,none,present,none,none,to buy gifts,happy,to give gifts
the cake has candles on it.,courtesy,none,none,none,hungry,none,none,to buy candles,happy,to eat the cake
the kids are looking at the presents.,courtesy,none,none,none,curious,smiles,to see what they have,none,happy,to open the gifts
the boy is grinning.,courtesy,none,none,none,happy,none,none,none,happy,to smile
