sentence,principle,oEffect,oReact,oWant,xAttr,xEffect,xIntent,xNeed,xReact,xWant
the boy and dog are in the backyard.,cleanliness,none,none,none,playful,gets bitten,to play,to go outside,happy,to play with the dog
the boy has a shovel in their hand.,cleanliness,none,none,none,hardworking,gets dirty,to shovel,to go outside,tired,to shovel
the boy is putting dirt back in the ground.,cleanliness,none,none,none,responsible,gets dirty,to clean up,to get a shovel,relieved,to clean up the dirt
the dog has a bone in front of him.,cleanliness,none,none,none,determined,none,none,none,satisfied,to get a bone
the dog has his tongue sticking out.,cleanliness,none,none,none,silly,gets licked,to be silly,none,silly,to clean up
the dog fur is white.,cleanliness,none,none,none,white,none,none,none,happy,to wash their hands
there are big trees in the background.,cleanliness,none,none,none,quiet,none,none,none,isolated,to be noticed
the boy is on his knees.,cleanliness,none,none,none,caring,none,to be respectful,none,happy,to propose
