sentence,principle,oEffect,oReact,oWant,xAttr,xEffect,xIntent,xNeed,xReact,xWant
the boy is holding a pie.,cooperation,none,none,none,hungry,gets dirty,to eat,to buy a pie,hungry,to eat the pie
the boy is grinning.,cooperation,none,none,none,happy,none,none,none,happy,to smile
the boy has on a chef hat.,cooperation,none,none,none,proud,gets dirty,to look good,to go to the restaurant,happy,to eat
the boy has on mittens.,cooperation,none,none,none,cold,gets cold,to be warm,to buy mittens,warm,to put them on
the boy has an apron.,cooperation,none,none,none,hungry,none,to cook,none,proud,to eat
the boy is wearing a green shirt.,cooperation,none,none,none,fashionable,gets complimented,to be warm,to put on the shirt,happy,to go out
the background is blue.,cooperation,none,none,none,hurt,none,none,none,sad,to get a tan
