sentence,principle,oEffect,oReact,oWant,xAttr,xEffect,xIntent,xNeed,xReact,xWant
the boy is in his room.,cleanliness,none,none,none,curious,none,to be alone,to be in the room,happy,to play
the boy s room is clean.,cleanliness,none,none,none,clean,none,to be clean,to clean,clean,to clean the room
the boy is bent down.,cleanliness,none,none,none,curious,none,none,none,sad,to get up
the boy does nt have any shoes on.,cleanliness,none,none,none,unskilled,gets scolded,none,none,sad,to get a new pair
the boy reaches for his shoes.,cleanliness,none,none,none,quick,none,to go outside,to be playing,ready,to go outside
the shoes are black.,cleanliness,none,none,none,unfashionable,none,none,none,sad,to wear the shoes
