sentence,principle,oEffect,oReact,oWant,xAttr,xEffect,xIntent,xNeed,xReact,xWant
the boys are walking into a classroom.,respect,none,none,none,curious,gets sweaty,to learn,to walk to the classroom,nervous,to learn
the boy in the blue shirt is looking at the boy in green.,respect,none,none,none,curious,smiles,none,none,happy,to talk to the boy
the boy in blue has a red notebook and a pen in his hands.,respect,none,none,none,smart,none,to write,none,smart,to write
the boy in blue looks shocked.,respect,none,none,none,shocked,none,none,none,surprised,to run away
the boy in green is looking at the boy in blue.,respect,none,none,none,curious,none,none,none,happy,to talk to the boy
the boy in green has a purple notebook in his hands.,respect,none,none,none,creative,gets scolded,to read,none,happy,to read the notebook
there s a tree behind the woman with the eagle.,respect,none,none,none,mean,none,none,none,happy,to get a bird
