sentence,principle,oEffect,oReact,oWant,xAttr,xEffect,xIntent,xNeed,xReact,xWant
the son is hiding behind the wall.,attentiveness,none,none,none,scared,gets caught,to be sneaky,to be hiding,scared,to get out
the son has his hands covering his face.,attentiveness,none,none,none,scared,gets yelled at,to hide their face,none,embarrassed,to hide
the boy is at the door.,attentiveness,none,none,to say hello,curious,personx is greeted,to see someone,none,curious,to say hello
the mom is walking towards the door.,attentiveness,none,none,none,tired,gets stopped,to leave,to get up,happy,to say goodbye
the a green lap sitting on the table.,attentiveness,none,none,none,playful,none,to have fun,none,happy,to have fun
