sentence,principle,oEffect,oReact,oWant,xAttr,xEffect,xIntent,xNeed,xReact,xWant
three bears are eating at a table.,,none,none,none,hungry,gets full,to eat,to be hungry,full,to eat
the baby bear is holding a spoon.,,none,none,none,caring,none,to feed the baby,none,happy,to feed the baby
the baby bear is talking to the parent.,,none,none,to cry,caring,none,to be heard,none,happy,to be a good baby
the parent is looking at the baby bear.,,none,none,none,caring,gets bitten,to see the baby,none,happy,to give the baby a hug
three mans eyes are all the way open.,,none,none,none,curious,none,none,none,curious,to see
