sentence,principle,oEffect,oReact,oWant,xAttr,xEffect,xIntent,xNeed,xReact,xWant
dad and the son are in the garden.,assistiveness,none,none,none,caring,gets dirty,to have fun,to go to the garden,happy,to plant flowers
there is a lawnmower outside.,assistiveness,none,none,none,active,none,none,none,bored,to get a new mower
the dad has a pal of water in his hand.,assistiveness,none,none,none,thirsty,none,to have a drink,none,happy,to drink the water
the boy has his mouth open wide.,assistiveness,none,none,none,loud,gets slapped,to be rude,none,embarrassed,to eat
the boy has his hands out to the side.,assistiveness,none,none,none,needy,gets caught,to be helpful,none,guilty,to get help
there are flowers behind them the boy is frowning.,assistiveness,none,none,none,sad,none,none,none,sad,to be a flower lover
