sentence,principle,oEffect,oReact,oWant,xAttr,xEffect,xIntent,xNeed,xReact,xWant
the boy is on the phone.,respect,none,none,none,talkative,none,to communicate,none,happy,to talk
the boy is writing on his dad s important paper.,respect,none,none,to read the paper,helpful,none,to be helpful,to get a pen,happy,to give the paper to the boy
dad is looking at the boy.,respect,none,none,none,curious,none,to be noticed,none,happy,to talk to the boy
dad has his mouth wide open.,respect,none,none,none,silly,gets yelled at,to be heard,none,embarrassed,to be heard
dad was on the computer.,respect,none,none,none,curious,gets tired,to be entertained,to turn on the computer,interested,to turn off the computer
the boy is frowning.,respect,none,none,none,annoyed,none,none,none,annoyed,to get away from the boy
