sentence,principle,oEffect,oReact,oWant,xAttr,xEffect,xIntent,xNeed,xReact,xWant
they are sitting in the back seat.,respect,none,none,none,bored,none,to be alone,to be in the back seat,relaxed,to relax
they all have on seat belts.,respect,none,none,none,prepared,none,to be safe,none,safe,to be safe
they are looking at the boy in the blue shirt.,respect,none,none,none,curious,smiles,to see the boy,none,happy,to ask the boy a question
the boy in the green is frowning.,respect,none,none,none,mean,none,none,none,sad,to get away from the boy
the boy in the blue is pointing out the window.,respect,none,none,none,observant,none,to be noticed,to be in the car,satisfied,to tell them something
