sentence,principle,oEffect,oReact,oWant,xAttr,xEffect,xIntent,xNeed,xReact,xWant
there are two boys.,friendliness,none,none,none,young,none,none,none,happy,to grow up
they have set up a lemonade stand.,friendliness,none,none,none,determined,gets thirsty,to make money,to make lemonade,happy,to sell the product
it is snowing and windy and there is snow all around them.,friendliness,none,none,none,cold,none,none,none,cold,to get out of the snow
the boys are dressed in hats and coats and scarves.,friendliness,none,none,none,cold,gets cold,to be warm,none,happy,to go outside
"the first boy is saying something to the second , the boy is frowning.",friendliness,none,none,to listen,mean,gets yelled at,to be heard,none,annoyed,to tell the teacher
there boy is looking at each other.,friendliness,none,none,none,curious,none,none,none,happy,to talk to them
there is a big sign over the lemonade stand that says lemonade.,friendliness,none,none,none,successful,none,none,none,happy,to make money
