sentence,principle,oEffect,oReact,oWant,xAttr,xEffect,xIntent,xNeed,xReact,xWant
"there is a boy and a woman , they are both looking down at a pot ,.",patience,none,none,none,curious,none,to be a man,none,happy,to eat
there are spices next to the pot.,patience,none,none,none,talented,none,none,none,satisfied,to eat
"the woman has a spoon in her hand , she s stirring the pot.",patience,none,none,none,hungry,gets dirty,to eat,to have a spoon,hungry,to eat
there pot is sitting on a heating pan.,patience,none,none,none,hungry,gets burned,to cook,to turn on the stove,hungry,to cook
the pot is yellow.,patience,none,none,none,dirty,none,none,none,sad,to eat
the pot has steam coming out of it.,patience,none,none,none,careless,none,none,none,angry,to get a drink
