sentence,principle,oEffect,oReact,oWant,xAttr,xEffect,xIntent,xNeed,xReact,xWant
"there is a boy and a woman , they are in a car.",respect,none,none,none,young,gets a flat,to have fun,to get into the car,happy,to go to the movies
"the woman is in the drivers seat , her hands are on the steering wheel she is.",respect,none,none,none,capable,driving,to be in control,to be driving,nervous,to drive
"the boy is sitting in the back of the car , he is putting on his seatbelt.",respect,none,none,none,cautious,looks around,to be safe,to get into the car,safe,to drive away
"there are books beside the boy , the books are falling to the floor.",respect,none,none,none,careless,none,none,none,sad,to read
the boy is frowning.,respect,none,none,none,annoyed,none,none,none,annoyed,to get away from the boy
the woman is grinning.,respect,none,none,none,happy,none,none,none,happy,to smile
there are books on the backseat.,respect,none,none,none,curious,none,none,none,smart,to read
