sentence,principle,oEffect,oReact,oWant,xAttr,xEffect,xIntent,xNeed,xReact,xWant
there are two groups of families.,friendliness,none,none,none,independent,none,none,none,happy,to be a good family
the mother and father as well the mother from the second group are all sitting at a.,friendliness,none,none,none,caring,none,to be alone,to be in a meeting,happy,to be a good example
they all have glasses of lemonade.,friendliness,none,none,none,thirsty,gets thirsty,to have a drink,to buy lemonade,satisfied,to drink the lemonade
in the middle of the table is a plate of cake.,friendliness,none,none,none,hungry,gets dirty,to eat,to have a plate,full,to eat the cake
the boy from the first family is smiling and holding a jug of lemonade.,friendliness,none,none,none,happy,none,to be nice,none,happy,to drink the lemonade
the boy from the second family is standing beside his mother and reaching out to shake the.,friendliness,none,none,hand,friendly,hand,hand,to be near mother,happy,to talk to the child
