sentence,principle,oEffect,oReact,oWant,xAttr,xEffect,xIntent,xNeed,xReact,xWant
there is a boy.,cleanliness,none,none,none,young,none,none,none,happy,to grow up
he is lifting up the cuffs of his pants to reveal a pink and a blue sock.,cleanliness,none,none,none,naughty,none,to be a cop,to be in a room,embarrassed,to show off the new outfit
the boy is looking down at the socks mouth gaping.,cleanliness,none,none,none,curious,none,none,none,confused,to get away from the boy
behind him the school bus is pulling up.,cleanliness,none,none,none,prepared,none,none,to get to the bus stop,happy,to get off the bus
there boy has a book bag on his back.,cleanliness,none,none,none,smart,none,to be prepared,to go to the library,happy,to read
the school bus is yellow.,cleanliness,none,none,none,careless,none,none,none,annoyed,to go to school
