sentence,principle,oEffect,oReact,oWant,xAttr,xEffect,xIntent,xNeed,xReact,xWant
there are two boys and a dog.,self-care,none,none,none,playful,none,none,none,happy,to play with the dog
the two boys have jackets and hats on.,self-care,none,none,none,cold,none,to be warm,none,warm,to be warm
the first boy is throwing a frisbee to the second boy.,self-care,none,happy,to play,playful,gets hit,to play,to go to the first boy,happy,to play with the frisbee
the dog is jumping up to the frisbee.,self-care,none,none,none,energetic,gets exercise,to play,to be playing,happy,to play
there are in the back yard.,self-care,none,none,none,observant,none,to be alone,to go to the back yard,happy,to go to the bathroom
the back yard is fenced in.,self-care,none,none,none,cautious,gets dirty,none,to have a yard,safe,to get out of the yard
"they have hats , scarves , gloves , and a coat on.",self-care,none,none,none,cold,none,to be warm,none,warm,to be warm
the dog is white.,self-care,none,none,none,white,none,none,none,happy,to feed the dog
