sentence,principle,oEffect,oReact,oWant,xAttr,xEffect,xIntent,xNeed,xReact,xWant
there is a boy in the sidewalk.,attentiveness,none,none,none,young,none,none,none,happy,to get a ride home
he is looking at a car that is pulling out of the driveway.,attentiveness,none,none,none,curious,gets a flat,none,to drive to the driveway,interested,to drive the car
the tail lights are flashing.,attentiveness,none,none,none,careless,none,none,none,happy,to get a better look
there boy stops in front of a house.,attentiveness,none,none,none,curious,none,to be in the house,to be walking,happy,to knock on the door
there is a big tree in front of the house.,attentiveness,none,none,none,tall,none,none,none,happy,to get a tree
