sentence,principle,oEffect,oReact,oWant,xAttr,xEffect,xIntent,xNeed,xReact,xWant
there is a boy.,cleanliness,none,none,none,young,none,none,none,happy,to grow up
he is looking behind him.,cleanliness,none,none,none,curious,none,to see what 's behind,none,curious,to find something
he has a dustpan in his hand and he is emptying it out into the garbage bag.,cleanliness,none,none,none,dirty,gets dirty,to clean up,to have a dustpan,relieved,to clean up the mess
the boy is frowning.,cleanliness,none,none,none,annoyed,none,none,none,annoyed,to get away from the boy
there is a refrigerator next to the garbage bin.,cleanliness,none,none,none,careless,none,none,none,indifferent,to clean up
there is a broom next to the bin.,cleanliness,none,none,none,careless,gets dirty,none,none,annoyed,to clean up the mess
there are papers and notes posted on the refrigerator.,cleanliness,none,none,none,curious,none,to be informed,to have a pen and paper,satisfied,to read
