sentence,principle,oEffect,oReact,oWant,xAttr,xEffect,xIntent,xNeed,xReact,xWant
there are two boys.,politeness,none,none,none,young,none,none,none,happy,to grow up
they are talking to each other in the gym.,politeness,none,none,none,friendly,gets exercise,to be heard,to be in gym,happy,to get some exercise
behind them are other kids playing hoops.,politeness,none,none,to play with personx,playful,none,to have fun,to be playing,happy,to have fun
there the kids have a basketball in their hands.,politeness,none,none,none,playful,gets sweaty,to play basketball,to have a ball,happy,to play
there is a boy in the back that is trying to shoot the ball in the basketball.,politeness,none,none,none,athletic,gets hit,to play,to have a ball,happy,to get the ball
