sentence,principle,oEffect,oReact,oWant,xAttr,xEffect,xIntent,xNeed,xReact,xWant
there is a boy.,self-care,none,none,none,young,none,none,none,happy,to grow up
he is sitting in front of a desk.,self-care,none,none,none,bored,gets tired,to work,to walk to the desk,bored,to work
"on the desk is a computer , books papers and a pencil.",self-care,none,none,none,studious,none,to be a computer,to have a computer,smart,to write a report
in the boys hand is a sheet of paper.,self-care,none,none,none,smart,none,none,none,happy,to read the paper
the boy is frowning.,self-care,none,none,none,annoyed,none,none,none,annoyed,to get away from the boy
behind the desk is a bulletin board with papers pinned up on it.,self-care,none,none,none,careless,none,none,none,annoyed,to read the papers
