sentence,principle,oEffect,oReact,oWant,xAttr,xEffect,xIntent,xNeed,xReact,xWant
there is a boy.,cleanliness,none,none,none,young,none,none,none,happy,to grow up
he is wearing black swimming trunks and has a orange beach towel over his shoulders.,cleanliness,none,none,none,hot,gets sunburned,to be dry,to put on a bathing suit,dry,to dry off
he is rummaging through his closet.,cleanliness,none,none,none,curious,finds something,to find something,to open the closet,curious,to find something
behind him is his bed.,cleanliness,none,none,none,lazy,none,none,none,happy,to sleep
it has sweaters and shirts on it.,cleanliness,none,none,none,stylish,gets cold,to be warm,none,warm,to wear the sweater
beneath it is a pair of green fins.,cleanliness,none,none,none,curious,none,none,none,happy,to get a pair of green fins
there boy has rolling skates in his hand.,cleanliness,none,none,none,playful,gets dirty,to have fun,to go to the park,happy,to play with the skateboard
there a boot next to his foot.,cleanliness,none,none,none,mean,gets hurt,none,none,hurt,to get up
there are items under the bed.,cleanliness,none,none,none,careless,none,none,none,relieved,to clean up
