sentence,principle,oEffect,oReact,oWant,xAttr,xEffect,xIntent,xNeed,xReact,xWant
the.,patience,none,none,none,determined,none,to be a good friend,none,happy,to get a drink
kids are in line.,patience,none,none,none,patient,gets yelled at,to get something,none,annoyed,to get something
the kids are standing up.,patience,none,none,none,active,none,to be standing,none,good,to go to the bathroom
there s one girl in line.,patience,none,none,none,hopeful,gets kissed,none,none,happy,to go to the prom
there s two boys in line.,patience,none,none,none,young,none,none,none,happy,to go home
the boy in the green shirt is looking at his elbow.,patience,none,none,none,curious,none,none,none,curious,to ask the boy a question
the boy in the blue shirt is holding an ice cream cone.,patience,none,none,none,hungry,gets a sugar rush,to eat ice cream,to go to the ice cream shop,happy,to eat the ice cream
the girl at the end of the line is looking at the boy in the green shirt.,patience,none,none,to smile,curious,blushes,to be noticed,none,happy,to flirt
