sentence,principle,oEffect,oReact,oWant,xAttr,xEffect,xIntent,xNeed,xReact,xWant
the mom is holding a leash.,law-abiding,none,none,none,caring,none,to be responsible,to go to the pet store,responsible,to let the dog run
the boy is staring at his mom.,law-abiding,none,none,to talk to personx,curious,gets scolded,to be noticed,none,curious,to talk to his mom
the dog is staring at the mom.,law-abiding,none,none,none,curious,gets bitten,to be noticed,none,curious,to get a dog
the family is by the front door.,law-abiding,none,none,to say hello,friendly,gets yelled at,to see them,to walk to the front door,happy,to say hello
the mother is frowning.,law-abiding,none,none,none,angry,none,none,none,sad,to cry
the boy has his hands in his pockets.,law-abiding,none,none,none,sneaky,none,to hide something,none,nervous,to hide
