sentence,principle,oEffect,oReact,oWant,xAttr,xEffect,xIntent,xNeed,xReact,xWant
the kids are outside.,attentiveness,none,none,none,caring,none,to play,to be with the kids,happy,to play
the kids have on backpacks.,attentiveness,none,none,none,irresponsible,gets yelled at,to be a good parent,to buy the backpack,happy,to be a good parent
the kids are standing up.,attentiveness,none,none,none,active,none,to be standing,none,good,to go to the bathroom
the kids are smiling at each other.,attentiveness,none,happy,to smile,friendly,none,none,none,happy,to laugh
the girl with the pink backpack is smiling.,attentiveness,none,happy,to say hello,friendly,none,none,none,happy,to say hello
she is saying something and gesturing with her hands.,attentiveness,none,none,none,expressive,gets yelled at,to be understood,none,heard,to get attention
there are two boys standing in front of her.,attentiveness,none,none,none,young,none,none,none,happy,to get to know them
the two boys are laughing.,attentiveness,none,none,none,amused,none,none,none,happy,to have fun
