sentence,principle,oEffect,oReact,oWant,xAttr,xEffect,xIntent,xNeed,xReact,xWant
the boy is walking toward the stage.,respect,none,none,none,confident,gets nervous,to be noticed,to get ready,happy,to get a drink
the students are in the theater at school.,respect,none,none,to learn,studious,gets tired,to be entertained,to go to the theater,happy,to learn
the students are sitting in green chairs.,respect,none,none,none,friendly,none,to sit down,to walk to the green chairs,happy,to sit down
the boy with blonde hair is holding an paper.,respect,none,none,none,curious,none,to read,none,happy,to read the paper
the boy with the red shirt is waving to the boy with the blonde hair.,respect,none,none,to say hello,friendly,none,to be a good friend,none,happy,to say hello
there is a sign on the stage.,respect,none,none,none,famous,gets a raise,none,none,nervous,to get a raise
