sentence,principle,oEffect,oReact,oWant,xAttr,xEffect,xIntent,xNeed,xReact,xWant
the kids are at a costume party.,friendliness,none,happy,to go home,fun,gets dirty,to have fun,to buy costume,happy,to have fun
there is a halloween pumpkin on the table.,friendliness,none,none,none,fun,gets dirty,none,to buy halloween decorations,happy,to have fun
there is a clown behind the girl in a purple princess outfit.,friendliness,none,happy,to get away from personx,silly,gets kissed,none,to be a clown,happy,to impress
the boy in the football uniform is smiling at the girl.,friendliness,none,happy,to smile back,friendly,none,none,none,happy,to say hello
the girl in the purple princess costume is holding an orange bowl.,friendliness,none,none,none,creative,gets dirty,to eat,to buy a bowl,happy,to eat the food
they are all smiling.,friendliness,none,none,none,happy,none,none,none,happy,to be happy
