sentence,principle,oEffect,oReact,oWant,xAttr,xEffect,xIntent,xNeed,xReact,xWant
the boy is in the restroom.,cleanliness,none,none,none,scared,none,to be alone,to go to the bathroom,relieved,to wash hands
the mother is looking at her son.,cleanliness,none,none,none,caring,none,to see her son,none,happy,to hug her son
the mother is smiling.,cleanliness,none,none,none,happy,none,none,none,happy,to be happy
the mother has towels in her hand.,cleanliness,none,none,none,helpful,none,to be clean,to have a towel,happy,to clean up
the boy is putting something onto the rack.,cleanliness,none,none,none,careless,none,to be a good son,none,satisfied,to get it off
there is a plant on the top rack.,cleanliness,none,none,none,talented,none,none,none,happy,to grow a garden
