sentence,principle,oEffect,oReact,oWant,xAttr,xEffect,xIntent,xNeed,xReact,xWant
the boys are playing soccer.,cooperation,none,none,to have fun,athletic,gets exercise,to have fun,to get the ball,tired,to have fun
there are two teams red and blue.,cooperation,none,none,none,competitive,none,none,none,happy,to win
there is a ball in the net.,cooperation,none,none,none,playful,none,none,to be playing,happy,to play
the boy in the blue is holding the ball.,cooperation,none,none,none,playful,gets hit,to play,to be playing,happy,to play with the ball
the boy in the blue is looking concerned.,cooperation,none,none,none,concerned,none,none,none,worried,to help the boy
the boy in the red is looking at the boy in the blue.,cooperation,none,none,none,curious,none,to see the boy,none,happy,to talk to the boy
the boy in the red is frowning.,cooperation,none,none,none,mean,none,none,none,angry,to get away from the boy
the boy in the red hands is up to his sides.,cooperation,none,none,none,brave,none,to be a hero,none,happy,to be a good friend
