sentence,principle,oEffect,oReact,oWant,xAttr,xEffect,xIntent,xNeed,xReact,xWant
the boys are playing in the living room.,politeness,none,none,none,playful,gets exercise,to have fun,to go to the living room,happy,to have fun
the grandfather is sleeping in the chair.,politeness,none,none,none,tired,snores,to rest,to be in the chair,tired,to wake up
the boy in the green is rolling the dice.,politeness,none,none,none,daring,wins,to win,none,excited,to win
the boy in the green has a card in his hand.,politeness,none,none,none,sneaky,none,none,none,happy,to read the card
the boy in the green is smiling.,politeness,none,none,none,friendly,none,none,none,happy,to be a good friend
the boy in the blue looks shocked.,politeness,none,none,none,shocked,gets scared,none,none,surprised,to run away
the boy in the blue has his hand on his head.,politeness,none,none,none,caring,gets hit,to be noticed,none,happy,to play with the boy
the boy in the blue has money in his hand.,politeness,none,none,none,rich,none,to be rich,none,happy,to spend the money
