sentence,principle,oEffect,oReact,oWant,xAttr,xEffect,xIntent,xNeed,xReact,xWant
the mom and son are standing over the stove.,patience,none,none,none,hungry,none,to cook,to be cooking,hungry,to cook
the stove is on.,patience,none,none,none,hungry,none,to cook,to turn on the stove,hungry,to cook
there are two pots on the stove.,patience,none,none,none,hungry,none,none,none,hungry,to cook
the mom has a utensil stirring the pot.,patience,none,none,none,hungry,none,to eat,to have a spoon,hungry,to eat
the mom is frowning and has her hands on her hips.,patience,none,none,none,mean,none,to show off her new dress,none,annoyed,to get away from her
the boy is looking into the pot.,patience,none,none,none,curious,none,to find out what is in the pot,none,curious,to find out what the pot is
the boy is frowning at the pot.,patience,none,none,none,annoyed,none,none,none,annoyed,to eat
