sentence,principle,oEffect,oReact,oWant,xAttr,xEffect,xIntent,xNeed,xReact,xWant
they are in the library.,law-abiding,none,none,none,studious,none,to learn,to go to the library,bored,to read
the boy in the green sweater is on the floor.,law-abiding,none,none,none,curious,none,none,none,happy,to get up
the boy s bookbag is opened.,law-abiding,none,none,none,careless,none,to be helpful,none,happy,to read
the boy pulls the book from his bookbag.,law-abiding,none,none,none,curious,none,to read,to be a bookworm,satisfied,to read
the boy is grinning at the boy.,law-abiding,none,none,to smile,friendly,none,none,none,happy,to smile
the boy in the blue jacket is standing behind the boy.,law-abiding,none,none,none,sneaky,none,to be close to the boy,none,happy,to say hello
the boy in the blue jacket is looking at the other boy.,law-abiding,none,none,none,curious,none,to be observant,none,happy,to talk to the boy
the boy in the blue jacket is holding his bookbag.,law-abiding,none,none,none,careful,none,to be helpful,to find the bookbag,happy,to go to the library
