sentence,principle,oEffect,oReact,oWant,xAttr,xEffect,xIntent,xNeed,xReact,xWant
the kids are in the gym class.,cooperation,none,none,none,athletic,gets exercise,to be healthy,to be in class,tired,to get better
there are three kids in the back dancing.,cooperation,none,none,none,playful,gets exercise,none,none,happy,to have fun
the other three kids are looking at each other.,cooperation,none,none,none,curious,none,none,none,happy,to talk
the boy in the red shorts is looking at the boy in the green shorts.,cooperation,none,none,none,curious,none,to be noticed,none,happy,to ask the boy a question
the boy in red has his hand out.,cooperation,none,none,none,needy,gets yelled at,to be helpful,none,guilty,to get a ride
the boy in the red is grinning.,cooperation,none,none,none,happy,none,none,none,happy,to laugh
the boy in the green is frowning.,cooperation,none,none,none,mean,none,none,none,sad,to get away from the boy
the boy in the green is looking at the boy in the red.,cooperation,none,none,none,curious,none,to see the boy,none,happy,to talk to the boy
the boy in the blue is looking at both boys.,cooperation,none,none,none,curious,none,to be observant,none,happy,to talk to them
