sentence,principle,oEffect,oReact,oWant,xAttr,xEffect,xIntent,xNeed,xReact,xWant
there are two pictures.,self-care,none,none,none,curious,none,none,none,happy,to be a photographer
the girl at the top is getting ready for bed.,self-care,none,none,none,tired,gets tired,to be prepared,to put on their pajamas,happy,to sleep
the girl s alarm clock says nine oclock.,self-care,none,none,none,responsible,none,none,none,happy,to wake up
the girl has on pajamas.,self-care,none,none,none,sleepy,gets scolded,to be comfortable,to buy pajamas,happy,to go to bed
the girl at the bottom is in the living room.,self-care,none,none,none,engaged,none,none,to walk to the living room,happy,to get up
the girl is on kneeling on the floor.,self-care,none,none,none,submissive,gets dirty,to pray,none,sad,to get up
the girl has a ribbon in her hand.,self-care,none,none,none,proud,none,to show off,to go to the store,happy,to show it to her friends
the girl is playing with the kitten.,self-care,none,none,none,playful,gets bitten,to have fun,to go to the kitten,happy,to feed it
the kitten is playing with the ribbon.,self-care,none,none,none,playful,gets a sore hand,to be a good pet,to go to the park,happy,to win the game
