sentence,principle,oEffect,oReact,oWant,xAttr,xEffect,xIntent,xNeed,xReact,xWant
they are standing in the hallway.,respect,none,none,none,patient,none,none,none,nervous,to walk away
there is a poster on the wall.,respect,none,none,none,famous,none,none,none,happy,to be recognized
the girl is holding a flyer.,respect,none,none,none,curious,none,to be informed,none,interested,to read the flyer
the flyer says vote for sue the girl is looking at the boy.,respect,none,none,to get away from the boy,mean,gets yelled at,to be a good citizen,to be in a meeting,satisfied,to tell the truth
the girl is grinning.,respect,none,none,to smile,happy,none,none,none,happy,to tell everyone about it
the boy is standing next to the girl.,respect,none,happy,to talk to personx,friendly,gets a kiss,to be near the girl,to walk up to the girl,happy,to talk to the girl
the boy is looking at the flyer.,respect,none,none,none,curious,none,to know what it says,none,interested,to read the flyer
the boy is frowning.,respect,none,none,none,annoyed,none,none,none,annoyed,to get away from the boy
the boy has his hands on his hips.,respect,none,none,none,playful,gets yelled at,to be noticed,none,happy,to dance
