sentence,principle,oEffect,oReact,oWant,xAttr,xEffect,xIntent,xNeed,xReact,xWant
there are two boys and one girl.,respect,none,none,none,young,none,none,none,happy,to have a baby
the girl is in front of the boys holding a camera.,respect,none,none,to get a picture,curious,gets yelled at,to be a photographer,to be in front of the boys,happy,to take pictures
behind the boys is a big green house and a man dressed in a historical costume.,respect,none,none,none,famous,none,none,none,happy,to be a good influence
the man is standing by a red door.,respect,none,none,none,curious,gets yelled at,none,none,curious,to knock on the door
the man s costume is blue.,respect,none,none,none,creative,none,none,none,happy,to show off the costume
the man has a cane.,respect,none,none,none,capable,none,to be safe,none,happy,to walk
