sentence,principle,oEffect,oReact,oWant,xAttr,xEffect,xIntent,xNeed,xReact,xWant
there is a boy laying on the couch with an open book in his hand.,cleanliness,none,none,none,curious,none,none,none,happy,to read
"scattered on the floor is a skateboard , papers , a baseball bat , books , and.",cleanliness,none,none,none,athletic,none,to get a new skateboard,to get a skateboard,happy,to get a new skateboard
the mother is walking through the mess.,cleanliness,none,none,none,careless,gets dirty,none,none,tired,to clean up
he has two grocery bags in her hand.,cleanliness,none,none,none,prepared,gets dirty,to be prepared,to have a bag,prepared,to go to the store
the mother is frowning.,cleanliness,none,none,none,angry,none,none,none,sad,to cry
the boy has one foot on the skateboard.,cleanliness,none,none,none,athletic,gets hurt,none,to get on the skateboard,happy,to get a skateboard
the boy has a red purse under her arm.,cleanliness,none,none,none,careless,none,to hide something,none,happy,to go to the store
