sentence,principle,oEffect,oReact,oWant,xAttr,xEffect,xIntent,xNeed,xReact,xWant
there is a boy and his father at the theatre.,attentiveness,none,none,none,young,none,none,none,happy,to learn to play
the father has stood up to let the girl and father into the aisle.,attentiveness,none,none,to go to the wedding,brave,none,to be a good father,to be a priest,happy,to go to the church
the boy is still sitting in the chair reading a book.,attentiveness,none,none,none,studious,gets bored,to learn,to sit down,bored,to read
he has pulled up one leg into the seat as the girl is walking past.,attentiveness,none,none,none,nervous,gets hurt,to be safe,to be walking,nervous,to get out of the car
the father is looking down at the boy and frowning.,attentiveness,none,none,none,curious,none,none,none,sad,to tell the boy to be quiet
