sentence,principle,oEffect,oReact,oWant,xAttr,xEffect,xIntent,xNeed,xReact,xWant
there is a boy sitting in a swivel chair.,politeness,none,none,none,bored,gets dizzy,none,none,bored,to sit down
he is slouched in the chair and swiveling back and forth.,politeness,none,none,none,bored,gets bored,to be lazy,none,bored,to get up
the boy is frowning.,politeness,none,none,none,annoyed,none,none,none,annoyed,to get away from the boy
beside him is a table with a car modeling set on it.,politeness,none,none,none,rich,none,to make money,to have a car,happy,to make money
behind the boy an acoustic guitar is leaning up against the bookshelf.,politeness,none,none,none,curious,none,to listen,to be near the bookshelf,happy,to listen to the boy
