sentence,principle,oEffect,oReact,oWant,xAttr,xEffect,xIntent,xNeed,xReact,xWant
there are three boys and a girl.,caution,none,none,none,young,none,none,none,happy,to have a baby
the boy and the girl are on one side trying to push the boat into the water.,caution,none,none,none,brave,none,to be in control,to get the boat,happy,to get the boat out of the water
they both have on orange life jackets.,caution,none,none,none,prepared,none,to be warm,none,happy,to wear the jacket
the third boy is holding up his life jacket and saying something to the others.,caution,none,none,to listen to personx,helpful,gets yelled at,to be a good person,to be a child,happy,to be a good person
the boy is frowning.,caution,none,none,none,annoyed,none,none,none,annoyed,to get away from the boy
the third boy is looking at the second and has his hands on his hips.,caution,none,none,none,curious,gets yelled at,to dance,none,nervous,to dance
