sentence,principle,oEffect,oReact,oWant,xAttr,xEffect,xIntent,xNeed,xReact,xWant
there is a boy digging through a closet.,cleanliness,none,none,none,young,gets dirty,to find something,to be in the closet,scared,to find something
"scattered on the floor are puzzle pieces , a baseball bat , a baseball mitt , a.",cleanliness,none,none,none,clumsy,a baseball bat,none,none,frustrated,a baseball bat
the boy is holding up one of the walkietalkies and is smiling.,cleanliness,none,none,none,playful,none,to show off,none,happy,to tell everyone
the boy has his armrest on the chair.,cleanliness,none,none,none,mean,gets yelled at,to be in control,none,happy,to sit down
the chair has a baseball mitt sitting on it.,cleanliness,none,none,none,careless,gets yelled at,none,none,uncomfortable,to play baseball
the boy is on his knees.,cleanliness,none,none,none,caring,none,to be respectful,none,happy,to propose
