sentence,principle,oEffect,oReact,oWant,xAttr,xEffect,xIntent,xNeed,xReact,xWant
there are three boys playing badminton in a park.,friendliness,none,none,none,playful,gets exercise,to have fun,to go to the park,happy,to have fun
the first boy is holding the.,friendliness,none,none,to be a good son,caring,none,to be a good son,to be a boy,happy,to hold the boy
shuttlecock and the racquet.,friendliness,none,none,none,playful,none,to be heard,none,happy,to play the game
the boy is smiling.,friendliness,none,none,none,friendly,none,none,none,happy,to smile
there is a second boy standing in front of him with his hands in his pockets.,friendliness,none,none,none,nervous,none,to be polite,none,nervous,to walk away
across the net another boy stands waving his racquet.,friendliness,none,none,to play,playful,gets hit,to play a game,to be playing,happy,to play the game
