sentence,principle,oEffect,oReact,oWant,xAttr,xEffect,xIntent,xNeed,xReact,xWant
there is a boy and his father.,friendliness,none,none,none,young,none,none,none,happy,to grow up
they are standing at a table.,friendliness,none,none,none,hungry,gets hungry,to eat,none,hungry,to eat
the father is fixing up a wooden bird house.,friendliness,none,none,none,skilled,gets dirty,to have a bird house,to buy wood,happy,to sell the bird house
the boy is looking at a radio.,friendliness,none,none,none,curious,gets yelled at,to hear music,none,interested,to listen to the radio
beneath the table are boxes with colored labels.,friendliness,none,none,none,careless,none,none,none,confused,to make a mistake
one of the boxes reads garage.,friendliness,none,none,none,curious,none,to read,to open the box,interested,to read the letters
