sentence,principle,oEffect,oReact,oWant,xAttr,xEffect,xIntent,xNeed,xReact,xWant
the boy in green has his pencil behind his ear.,attentiveness,none,none,none,curious,none,to be noticed,none,happy,to write something down
the boy has his feet kicked back.,attentiveness,none,none,none,aggressive,gets hurt,to be in pain,none,hurt,to get up
he has his hands behind his head.,attentiveness,none,none,none,sneaky,gets caught,to hide,none,sneaky,to hide
the boy in green is smiling.,attentiveness,none,none,none,friendly,none,none,none,happy,to smile
the boy in the blue shirt is looking at him.,attentiveness,none,none,none,curious,none,to see the boy,none,happy,to talk to the boy
the kids are in school.,attentiveness,none,none,none,responsible,none,none,none,happy,to go to school
