sentence,principle,oEffect,oReact,oWant,xAttr,xEffect,xIntent,xNeed,xReact,xWant
the boy in the red has his face in his arm.,cleanliness,none,none,none,mean,none,none,none,ashamed,to hide
the girl is in the middle of the two boys.,cleanliness,none,none,to get away from personx,awkward,gets yelled at,none,none,sad,to get away from the situation
the girl in the middle is also holding a book.,cleanliness,none,none,none,studious,none,to read,none,happy,to read
the boy in the yellow is smiling at his friends.,cleanliness,none,happy,to smile back,friendly,none,to be happy,none,happy,to say hello
the boy in the yellow is also holding a book.,cleanliness,none,none,none,curious,none,to read,none,happy,to read
