sentence,principle,oEffect,oReact,oWant,xAttr,xEffect,xIntent,xNeed,xReact,xWant
the boy in the red has his hands up.,respect,none,none,none,brave,gets caught,to be a hero,none,happy,to run away
the friend is handing him a book.,respect,none,grateful,to read the book,helpful,none,to share,to be a librarian,happy,to give the book back
the book says sarah s journal.,respect,none,none,none,smart,none,to write,to read,happy,to write a journal
it also says keep out.,respect,none,none,none,mean,none,to be mean,none,relieved,to keep quiet
the boy in red is looking down at the book and frowning.,respect,none,none,none,pensive,none,none,none,annoyed,to read
the sign on the wall says sarah s room.,respect,none,none,none,helpful,none,to be a good citizen,none,interested,to go to the room
