sentence,principle,oEffect,oReact,oWant,xAttr,xEffect,xIntent,xNeed,xReact,xWant
they are outside.,friendliness,none,none,none,outdoors,gets exercise,to have fun,to be outside,happy,to go to the store
the kids are standing in front of the lady.,friendliness,none,none,to say hello,polite,gets yelled at,to be polite,to walk up to the lady,happy,to get a hug
the lady is looking at the kids.,friendliness,none,none,none,caring,none,to be a good parent,none,happy,to talk to the kids
the lady has her hands in the air.,friendliness,none,none,none,playful,gets hit,to play a game,none,happy,to run away
the kids are laughing.,friendliness,none,none,none,amused,none,none,none,happy,to have fun
the kids have a smile on their face.,friendliness,none,happy,to smile,happy,none,none,none,happy,to be happy
